{
  "format": "dynamite-uv-pack",
  "formatVersion": 2,
  "id": "example.synthetic-pulse",
  "revision": 1,
  "title": "Synthetic Pulse",
  "artist": "Dynamite UV Contributors",
  "audio": "audio.wav",
  "preview": {
    "startSec": 0.5,
    "durationSec": 4.0
  },
  "charts": [
    {
      "id": "hard",
      "difficulty": "hard",
      "level": 12,
      "charters": [
        "Example Charter"
      ],
      "file": "chart_hard.json"
    },
    {
      "id": "triple-star",
      "difficulty": "custom",
      "difficultyKey": "***",
      "level": 15,
      "charters": [
        "Example Charter"
      ],
      "file": "chart_custom.json"
    }
  ]
}
